{
  "version": 1,
  "type": "development",
  "title": "4+1 · 开发视图",
  "description": "面向研发组织：源代码模块与可替换的基础设施适配器。",
  "theme": "paper",
  "direction": "TB",
  "groups": [
    {
      "id": "core",
      "label": "核心代码 / packages",
      "kind": "package"
    },
    {
      "id": "adapters",
      "label": "基础设施适配 / adapters",
      "kind": "package"
    }
  ],
  "nodes": [
    {
      "id": "web",
      "label": "apps/storefront",
      "kind": "package",
      "detail": "读者前端"
    },
    {
      "id": "api",
      "label": "apps/order-api",
      "kind": "component",
      "detail": "HTTP 入口"
    },
    {
      "id": "app",
      "label": "order/application",
      "kind": "package",
      "group": "core"
    },
    {
      "id": "domain",
      "label": "order/domain",
      "kind": "package",
      "group": "core"
    },
    {
      "id": "ports",
      "label": "order/ports",
      "kind": "package",
      "group": "core"
    },
    {
      "id": "sql",
      "label": "postgres-adapter",
      "kind": "component",
      "group": "adapters"
    },
    {
      "id": "mq",
      "label": "event-adapter",
      "kind": "component",
      "group": "adapters"
    }
  ],
  "edges": [
    {
      "from": "web",
      "to": "api",
      "kind": "dependency",
      "label": "接口契约"
    },
    {
      "from": "api",
      "to": "app",
      "kind": "dependency"
    },
    {
      "from": "app",
      "to": "domain",
      "kind": "dependency"
    },
    {
      "from": "app",
      "to": "ports",
      "kind": "dependency"
    },
    {
      "from": "sql",
      "to": "ports",
      "kind": "dependency"
    },
    {
      "from": "mq",
      "to": "ports",
      "kind": "dependency"
    }
  ]
}
