{
  "version":1, "id":"production-deployment", "type":"deployment", "title":"生产部署 · 双实例、缓存与主备复制", "theme":"blueprint", "direction":"LR",
  "description":"接入区、两个应用实例与数据区；同一实例连接数据库、缓存、消息队列，带协议和端口标注，主备数据库复制独立表示。",
  "groups":[
    {"id":"edge","label":"公网接入区","kind":"node"},{"id":"cluster","label":"生产 Kubernetes 集群","kind":"node"},
    {"id":"data","label":"受限数据区","kind":"node"}
  ],
  "nodes":[
    {"id":"client","label":"用户浏览器","kind":"component"},{"id":"ingress","label":"Ingress / WAF","kind":"server","group":"edge"},
    {"id":"pod-a","label":"订单实例 A","kind":"server","stereotype":"pod","group":"cluster"},
    {"id":"pod-b","label":"订单实例 B","kind":"server","stereotype":"pod","group":"cluster"},
    {"id":"worker","label":"履约消费者","kind":"server","stereotype":"worker","group":"cluster"},
    {"id":"primary","label":"PostgreSQL 主库","kind":"database","group":"data"},
    {"id":"replica","label":"PostgreSQL 备库","kind":"database","group":"data"},
    {"id":"redis","label":"Redis 缓存","kind":"database","group":"data"},{"id":"mq","label":"消息队列","kind":"queue","group":"data"}
  ],
  "edges":[
    {"from":"client","to":"ingress","label":"HTTPS :443"},{"from":"ingress","to":"pod-a","label":"HTTP :8080"},
    {"from":"ingress","to":"pod-b","label":"HTTP :8080"},{"from":"pod-a","to":"primary","label":"SQL :5432"},
    {"from":"pod-b","to":"primary","label":"SQL :5432"},{"from":"primary","to":"replica","label":"WAL 复制","dashed":true},
    {"from":"pod-a","to":"redis","label":"RESP :6379"},{"from":"pod-b","to":"redis","label":"RESP :6379"},
    {"from":"pod-a","to":"mq","label":"AMQP :5672","dashed":true},{"from":"mq","to":"worker","label":"消费","dashed":true}
  ]
}
