{
  "version":1,"type":"usecase","title":"登录认证 · 用例图","direction":"LR",
  "groups":[{"id":"auth","label":"登录认证系统","kind":"boundary"}],
  "nodes":[
    {"id":"user","label":"用户","kind":"actor"},{"id":"admin","label":"管理员","kind":"actor"},
    {"id":"login","label":"用户登录","group":"auth"},{"id":"register","label":"注册账号","group":"auth"},
    {"id":"reset","label":"找回密码","group":"auth"},{"id":"verify","label":"验证码校验","group":"auth"},
    {"id":"twofa","label":"二次验证（2FA）","group":"auth"},{"id":"audit","label":"登录审计","group":"auth"},
    {"id":"lock","label":"账号锁定管理","group":"auth"}
  ],
  "edges":[
    {"from":"user","to":"login"},{"from":"user","to":"register"},{"from":"user","to":"reset"},
    {"from":"login","to":"verify","kind":"include"},{"from":"register","to":"verify","kind":"include"},
    {"from":"reset","to":"verify","kind":"include"},{"from":"twofa","to":"login","kind":"extend"},
    {"from":"audit","to":"login","kind":"extend"},{"from":"admin","to":"audit"},{"from":"admin","to":"lock"}
  ]
}
